Strand,SubStrand,Description_V2,Description_V1,Comment
Achievement Standard,"History Levels 7–8","By the end of Level 8, students can analyse different interpretations of the establishment of early societies, explain global patterns of continuity and change and the sources of historical evidence of the period. They can describe the historical significance of the histories of Aboriginal and Torres Strait Islander Peoples’ histories and cultures, ancient societies of Europe, Africa or Asia, and societies leading to the modern world between 600 and 1750 CE.","By the end of Level 8, students identify and explain patterns of change and continuity over time. They analyse the causes and effects of events and developments. They identify the motives and actions of people at the time. Students evaluate the significance of individuals and groups and how they were influenced by the beliefs and values of their society. They evaluate different interpretations of the past.","Integrates more knowledge content descriptions and aligns with VC2 structure"
Achievement Standard,"History Levels 7–8","Students develop and apply historical questions to support the process of historical inquiry, when using historical concepts and sources across the range of historical contexts. They order historical narratives of events, ideas and developments chronologically to explain varied patterns and forms of continuity and change and their causes and consequences.","Students sequence events and developments within a chronological framework with reference to periods of time. They locate and select historical sources and identify their origin, content features and purpose. Students explain the historical context of these sources.","Expanded inquiry and chronology language"
Achievement Standard,"History Levels 7–8","Students explain the features, content and context of primary and secondary sources and apply historical questions when drawing inferences from sources. They interpret the information from historical sources by analysing and verifying their accuracy and value as historical evidence.","They compare and contrast historical sources and ask questions about their accuracy, usefulness and reliability.","Refined source analysis language"
Achievement Standard,"History Levels 7–8","Students use primary and secondary sources to identify and explain the perspectives of individuals and groups and use these sources to understand the beliefs, values and attitudes of the individuals and societies studied. Students recognise the contested nature of the histories of early and pre-modern societies and apply this knowledge to identify and analyse different historical interpretations and debates.","Students analyse the different perspectives of people in the past using sources. They explain different historical interpretations and contested debates about the past.","Merged perspectives and interpretations with expanded scope"
Achievement Standard,"History Levels 7–8","Students recognise and explain varied patterns and forms of continuity and change in the societies they have studied and identify and explain the significant events, individuals, ideas and developments that contributed continuity and change. They establish and analyse historical significance using criteria to recognise and analyse the role and contributions of individuals, events, locations, developments and legacies of the societies they have studied.","Students identify and explain patterns of change and continuity over time. They analyse the causes and effects of events and developments. Students evaluate the significance of individuals and groups.","Expanded significance and continuity/change criteria"
Achievement Standard,"History Levels 7–8","When constructing historical interpretations of the societies studied, students use historical concepts, terms, concepts, relevant knowledge, conventions and evidence obtained from their analysis of primary and secondary historical sources.","Students construct an explanation using sources of evidence to support the analysis. In developing these texts, and organising and presenting their findings, they use historical terms and concepts, evidence identified in sources, and acknowledge their sources of information.","Refined language for historical interpretation and communication"
