SubjectArea,Subject,Band,AchievementStandard_V1,AchievementStandard_V2,ChangeComment
Mathematics,Mathematics,Year 7,"Number and Algebra
Students solve problems involving the order, addition and subtraction of integers. They make the connections between whole numbers and index notation and the relationship between perfect squares and square roots. They solve problems involving all four operations with fractions, decimals, percentages and their equivalences, and express fractions in their simplest form. Students compare the cost of items to make financial decisions, with and without the use of digital technology. They make simple estimates to judge the reasonableness of results. Students use variables to represent arbitrary numbers and connect the laws and properties of number to algebra and substitute numbers into algebraic expressions. They assign ordered pairs to given points on the Cartesian plane and interpret and analyse graphs of relations from real data. Students develop simple linear models for situations, make predictions based on these models, solve related equations and check their solutions. 

Measurement and Geometry
Students use formulas for the area and perimeter of rectangles. They classify triangles and quadrilaterals and represent transformations of these shapes on the Cartesian plane, with and without the use of digital technology. Students name the types of angles formed by transversals crossing parallel lines and solve simple numerical problems involving these lines and angles. They describe different views of three-dimensional objects, and use models, sketches and digital technology to represent these views. Students calculate volumes of rectangular prisms.

Statistics and Probability
Students identify issues involving the collection of discrete and continuous data from primary and secondary sources. They construct stem-and-leaf plots and dot-plots. Students identify or calculate mean, mode, median and range for data sets, using digital technology for larger data sets. They describe the relationship between the median and mean in data displays. Students determine the sample space for simple experiments with equally likely outcomes, and assign probabilities outcomes.","By the end of Level 7, students represent natural numbers in expanded form and as products of prime factors, using exponent notation. They solve problems involving squares of numbers and square roots of perfect square numbers. Students solve problems involving addition and subtraction of integers. They use all 4 operations in calculations involving positive fractions and decimals, choosing efficient mental and written calculation strategies. Students choose between equivalent representations of rational numbers and percentages to assist in calculations and make simple estimates to judge the reasonableness of results. They use mathematical modelling to solve practical problems involving rational numbers, percentages and ratios in spatial, financial and other applied contexts, justifying choices of representation. 
Students use algebraic expressions to represent situations, describe the relationships between variables from authentic data and substitute values into formulas to determine unknown values. They solve linear equations with natural number solutions and verify their solutions through substitution. Students create tables of values relating to algebraic expressions and formulas, and describe how the values change.
Students apply knowledge of angle relationships and the sum of angles in a triangle to solve problems, giving reasons. They establish and use formulas for the areas of triangles and parallelograms and the volumes of rectangular and triangular prisms to solve problems. They describe the relationships between the radius, diameter and circumference of a circle. 
Students classify polygons according to their features and design an algorithm to sort and classify shapes. They represent objects two-dimensionally in different ways, describing the usefulness of these representations. They use coordinates to describe transformations of points in the plane.
Students plan and conduct statistical investigations involving discrete and continuous numerical data, using appropriate displays. They interpret data in terms of the shape of distribution and summary statistics, identifying possible outliers. They decide which measure of central tendency is most suitable and explain their reasoning. 
Students list sample spaces for single-step experiments, assign probabilities to outcomes of events and predict relative frequencies for related events. They conduct repeated single-step chance experiments and run simulations using digital tools, giving reasons for differences between predicted and observed results.","Removed the 3 strand headings because no longer relevant. Achievement standards have been split, refined and realigned to the revised Victorian curriculum."
Mathematics,Mathematics,Year 8,"Number and Algebra
Students use efficient mental and written strategies to make estimates and carry out the four operations with integers, and apply the index laws to whole numbers. They identify and describe rational and irrational numbers in context. Students estimate answers and solve everyday problems involving profit and loss rates, ratios and percentages, with and without the use of digital technology. They simplify a variety of algebraic expressions and connect expansion and factorisation of linear expressions. Students solve linear equations and graph linear relationships on the Cartesian plane.

Measurement and Geometry
Students convert between units of measurement for area and for volume. They find the perimeter and area of parallelograms, rhombuses and kites. Students name the features of circles, calculate circumference and area, and solve problems relating to the volume of prisms. They make sense of time duration in real applications, including the use of 24-hour time. Students identify conditions for the congruence of triangles and deduce the properties of quadrilaterals. They use tools, including digital technology, to construct congruent shapes. 


Statistics and Probability
Students explain issues related to the collection of sample data and discuss the effect of outliers on means and medians of the data. They use various approaches, including the use of the digital technology, to generate simple random samples from a population. Students model situations with Venn diagrams and two-way tables and explain the use of ‘not’, ‘and’ and ‘or’.  Students choose appropriate language to describe events and experiments. They determine complementary events and calculate the sum of probabilities.","By the end of Level 8, students recognise irrational numbers as numbers that cannot develop from the division of integer values by natural numbers and terminating or recurring decimals. They apply the exponent laws to calculations with numbers involving positive integer exponents. Students solve problems involving the 4 operations with integers and positive rational numbers. They use mathematical modelling to solve practical problems involving ratios, percentages and rates in measurement and financial contexts. 
Students apply algebraic properties to simplify, rearrange, expand and factorise linear expressions. They graph linear relations and solve linear equations with rational solutions and one-variable inequalities, graphically and algebraically. Students plot linear and non-linear relations on the Cartesian plane, with and without the use of digital tools. Students use mathematical modelling to solve problems using linear relations, interpreting and reviewing the model in context. They make and test conjectures involving linear relations by developing algorithms and using digital tools.
Students use appropriate metric units when solving measurement problems involving the perimeter and area of composite shapes, and volume of right prisms. They use Pythagoras’ theorem to solve measurement problems involving unknown lengths of right-angled triangles. Students use formulas to solve problems involving the area and circumference of circles. They solve problems of duration involving 12- and 24-hour cycles across multiple time zones. 
Students use 3 dimensions to locate and describe position. They identify conditions for congruency and similarity in triangles and other common shapes, and design and test algorithms to test for congruency and similarity. Students apply the properties of quadrilaterals to solve problems.
Students conduct statistical investigations and explain the implications of obtaining data through sampling. Students analyse and describe the distribution of data. They compare the variation in distributions of random samples of the same and different size from a given population with respect to shape, measures of central tendency and range. 
Students represent the possible combinations of 2 events with tables and diagrams, and determine related probabilities to solve practical problems. They conduct experiments or simulations using digital tools to determine related probabilities of compound events.","Removed the 3 strand headings because no longer relevant. Achievement standards have been split, refined and realigned to the revised Victorian curriculum."
Mathematics,Mathematics,Year 9,"Number and Algebra
Students apply the index laws using integer indices to variables and numbers, express numbers in scientific notation, solve problems involving very small and very large numbers, and check the order of magnitude of calculations. They solve problems involving simple interest. Students use the distributive law to expand algebraic expressions, including binomial expressions, and simplify a range of algebraic expressions. They find the distance between two points on the Cartesian plane and the gradient and midpoint of a line segment using a range of strategies including the use of digital technology. Students sketch and draw linear and non-linear relations, solve simple related equations and explain the relationship between the graphical and symbolic forms, with and without the use of digital technology.

Measurement and Geometry
Students solve measurement problems involving perimeter and area of composite shapes, surface area and volume of rectangular prisms and cylinders, with and without the use of digital technology. They relate three-dimensional objects to two-dimensional representations. Students explain similarity of triangles, interpret ratios and scale factors in similar figures, and apply Pythagoras’s theorem and trigonometry to solve problems involving angles and lengths in right-angled triangles.

Statistics and Probability
Students compare techniques for collecting data from primary and secondary sources, and identify questions and issues involving different data types. They construct histograms and back-to-back stem-and-leaf plots with and without the use of digital technology. Students identify mean and median in skewed, symmetric and bi-modal displays and use these to describe and interpret the distribution of the data. They calculate relative frequencies to estimate probabilities. Students list outcomes for two-step experiments and assign probabilities for those outcomes and related events.","By the end of Level 9, students recognise and use rational and irrational numbers to solve problems. 
Students extend and apply the exponent laws with positive integers and the zero exponent to variables. They expand binomial products and factorise monic quadratic expressions. They find the distance between 2 points on the Cartesian plane, sketch linear graphs and find the gradient and midpoint of a line segment. Students use mathematical modelling to solve problems involving change, including simple interest in financial contexts and change in other applied contexts, choosing to use linear and quadratic functions. They graph quadratic functions and use null factor law to solve monic quadratic equations with integer roots algebraically. Students investigate and describe the effects of variation of parameters on functions and relations, using digital tools where appropriate, and make connections between their graphical and algebraic representations.
Students apply formulas to solve problems involving the surface area and volume of right prisms, cylinders and composite shapes. They solve problems involving ratio, similarity and scale in two-dimensional situations. They determine percentage errors in measurements. Students apply Pythagoras’ theorem and use trigonometric ratios to solve problems involving right-angled triangles. They use mathematical modelling to solve practical problems involving direct and indirect proportion, ratio and scale, evaluating the model and communicating their methods and findings. Students express small and large numbers in scientific notation. 
Students apply the enlargement transformation to images of shapes and objects, and interpret results. They design, use and test algorithms based on geometric constructions or theorems.
Students compare and analyse the distributions of multiple numerical data sets, choose representations, describe features of these data sets using summary statistics and the shape of distributions, and consider the effect of outliers. They explain how sampling techniques and representation can be used to support or question conclusions or to promote a point of view. 
Students determine sets of outcomes for two-step chance experiments and represent these in various ways. They assign probabilities to the outcomes of two-step chance experiments. They design and conduct experiments or simulations for combined events using digital tools.","Removed the 3 strand headings because no longer relevant. Achievement standards have been split, refined and realigned to the revised Victorian curriculum."
Mathematics,Mathematics,Year 10,"Number and Algebra
Students recognise the connection between simple and compound interest. They solve problems involving linear equations and inequalities, quadratic equations and pairs of simultaneous linear equations and related graphs, with and without the use of digital technology. Students substitute into formulas, find unknown values, manipulate linear algebraic expressions, expand binomial expressions and factorise monic and simple non-monic quadratic expressions, with and without the use of digital technology. They represent linear, quadratic and exponential functions numerically, graphically and algebraically, and use them to model situations and solve practical problems.

Measurement and Geometry
Students solve and explain surface area and volume problems relating to composite solids. They use parallel and perpendicular lines, angle and triangle properties, similarity, trigonometry and congruence to solve practical problems and develop proofs involving lengths, angles and areas in plane shapes. They use digital technology to construct and manipulate geometric shapes and objects, and explore symmetry and pattern in two dimensions.

Statistics and Probability
Students compare univariate data sets by referring to summary statistics and the shape of their displays. They describe bivariate data where the independent variable is time and use scatter-plots generated by digital technology to investigate relationships between two continuous variables. Students evaluate the use of statistics in the media. They list outcomes for multi-step chance experiments involving independent and dependent events, and assign probabilities for these experiments.","By the end of Level 10, students recognise the effect of approximations of real numbers in repeated calculations. 
Students use mathematical modelling to solve problems involving growth and decay in financial and other applied situations, applying linear, quadratic and exponential functions as appropriate, and solve related equations, numerically and graphically. They make and test conjectures involving functions and relations using digital tools. Students substitute into formulas, find unknown values, manipulate linear and quadratic algebraic expressions, expand binomial expressions and factorise monic and simple non-monic quadratic expressions, with and without the use of digital tools. They solve problems involving linear equations and inequalities, quadratic equations and pairs of simultaneous linear equations and related graphs, algebraically and graphically, with and without the use of digital tools, and justify solutions. They represent linear, quadratic and exponential functions numerically, graphically and algebraically, and use them to model situations and solve practical problems. Students can design and implement simple algorithms using pseudocode or other general purpose programming language.
Students solve measurement problems involving surface area and volume of composite objects. They interpret and use logarithmic scales representing small or large quantities or change in applied contexts. Students apply Pythagoras’ theorem and trigonometry to solve practical problems involving right-angled triangles. They identify the impact of measurement errors on the accuracy of results. Students use mathematical modelling to solve practical problems involving direct and inverse proportion and scaling, evaluating and modifying models, and reporting assumptions, methods and findings. 
Students use deductive reasoning, theorems and algorithms to solve spatial problems. They interpret networks used to represent practical situations and describe connectedness. 
Students compare univariate data sets by referring to summary statistics and the shape of their displays. They plan and conduct statistical investigations involving bivariate data, including where the independent variable is time. They represent the distribution of data involving 2 variables, using tables and scatterplots, and comment on possible association. They analyse inferences and conclusions in the media, noting potential sources of bias. Students compare the distribution of continuous numerical data, using various displays, and discuss distributions in terms of centre, spread, shape and outliers. 
Students apply conditional probability to solve problems involving compound events. They design and conduct simulations involving conditional probability, using digital tools.","Removed the 3 strand headings because no longer relevant. Achievement standards have been split, refined and realigned to the revised Victorian curriculum."
